{
  "Id": "myceliumancer",
  "SubClassName": "Myceliumancer",
  "CharacterName": "Morel",
  "CharacterDescription": "Once a spelunker, now a host. The Mycelium took him, then found there was nothing in him it could break. Together they walk back toward the light, spreading as they go.\n\nHe does not remember his name. The hive does not mind.",
  "CharacterDescriptionStrength": "Fungal caster that rots enemies from range with Spore Rot and sustains the party with Symbiosis.",
  "MainCharacter": true,
  "InitialUnlock": false,
  "Sku": "",
  "SpriteSource": "",
  "FluffOffsetX": 0.2,
  "FluffOffsetY": 3.8,
  "Female": false,
  "StickerOffsetX": 0.0,
  "HeroClass": "Scout",
  "HeroClassSecondary": "Mage",
  "HeroClassThird": "None",
  "OrderInList": 0,
  "Blocked": false,
  "Speed": 14,
  "Hp": 96,
  "Energy": 1,
  "EnergyTurn": 3,
  "ResSlash": 5,
  "ResBlunt": 10,
  "ResPierce": 5,
  "ResFire": -15,
  "ResCold": 5,
  "ResLight": 0,
  "ResMind": 10,
  "ResHoly": -5,
  "ResShadow": 15,
  "ItemId": "mychyphaclub",
  "MaxHp": [
    0,
    8,
    8,
    8,
    8
  ],
  "Cards": [
    {
      "CardId": "mycsporestrike",
      "UnitsInDeck": 4
    },
    {
      "CardId": "myccapshield",
      "UnitsInDeck": 4
    },
    {
      "CardId": "mycrootlash",
      "UnitsInDeck": 2
    },
    {
      "CardId": "mycregrow",
      "UnitsInDeck": 1
    },
    {
      "CardId": "mycsporeburst",
      "UnitsInDeck": 1
    },
    {
      "CardId": "mycrotharvest",
      "UnitsInDeck": 1
    }
  ],
  "CardsSingularity": [
    "mycsporestrike",
    "myccapshield",
    "mycrootlash",
    "mycmycelialweb",
    "mycsporeburst",
    "mycrotharvest",
    "mycregrow",
    "mychivemind",
    "mycsporecloud",
    "defend",
    "faststrike",
    "intercept",
    "guard",
    "shakeitoff",
    "helpinghand",
    "mycburrow",
    "mycmold",
    "mycbracket",
    "mycparasiticbite",
    "mycfruitingbody",
    "mycrootbound",
    "mycdevouringbloom",
    "mycrebirth",
    "mycoutbreak"
  ],
  "Trait0": "myc_sporeborn",
  "Trait1A": "myc_fungalvigor",
  "Trait1ACard": "mycverdantpulse",
  "Trait1B": "myc_rotmaster",
  "Trait1BCard": "mycputrefy",
  "Trait2A": "myc_rootedstance",
  "Trait2B": "myc_caustictouch",
  "Trait3A": "myc_thickcap",
  "Trait3ACard": "mycsporeward",
  "Trait3B": "myc_blightedcore",
  "Trait3BCard": "mycblightcascade",
  "Trait4A": "myc_apexsymbiont",
  "Trait4B": "myc_sporelord",
  "CardsOnReplaceCharacter": [],
  "CardsOnReplaceCharacterInSingularity": [],
  "PerksOnReplace": "",
  "UseXpFromOriginal": false,
  "ChallengePack0": "myc_pack_sporeling",
  "ChallengePack1": "myc_pack_rotweaver",
  "ChallengePack2": "myc_pack_capguard",
  "ChallengePack3": "myc_pack_symbiont",
  "ChallengePack4": "myc_pack_blightbearer",
  "ChallengePack5": "myc_pack_thornhide",
  "ChallengePack6": "myc_pack_hivelord"
}